{
  "schema_version": "pdx_tool_result_v1",
  "status": "failed",
  "outputs": {},
  "retryable": false,
  "error": {
    "code": "RENDERER_NOT_AVAILABLE",
    "message": "no renderer is available for this format yet"
  },
  "tool_provider": "prodocux",
  "tool_version": "pending-a1",
  "transport": "http"
}
